{
    "schema_version": "1.0",
    "mapping_version": "2026-07-20",
    "source": {
        "name": "Malawi HMIS DHIS2",
        "base_url": "https://dhis2.health.gov.mw",
        "source_workbook": "Data Mapping - MNH dashboard - DHIS2.xlsx",
        "worksheet": "MNH indicators"
    },
    "reporting_period": {
        "period_type": "monthly",
        "start_period": "202504",
        "end_period": "202605"
    },
    "indicators": [
        {
            "id": "live_births",
            "name": "Live Births",
            "description": null,
            "source": "dhis2",
            "enabled": true,
            "value_type": "count",
            "calculation": {
                "operation": "sum",
                "operands": [
                    {
                        "type": "data_element",
                        "dx": "iBBnHx1Uf50",
                        "data_element_id": "iBBnHx1Uf50",
                        "category_option_combo_id": null
                    },
                    {
                        "type": "data_element",
                        "dx": "EeywK6AHQdK",
                        "data_element_id": "EeywK6AHQdK",
                        "category_option_combo_id": null
                    },
                    {
                        "type": "data_element",
                        "dx": "jz793Wzon1W",
                        "data_element_id": "jz793Wzon1W",
                        "category_option_combo_id": null
                    },
                    {
                        "type": "data_element",
                        "dx": "q7NoDcfaciO",
                        "data_element_id": "q7NoDcfaciO",
                        "category_option_combo_id": null
                    },
                    {
                        "type": "data_element",
                        "dx": "kaYz6eqxqQH",
                        "data_element_id": "kaYz6eqxqQH",
                        "category_option_combo_id": null
                    }
                ]
            },
            "validation": {
                "status": "valid",
                "messages": []
            },
            "source_reference": {
                "workbook_row": 2,
                "original_indicator_name": "Live Births",
                "original_mapping": "iBBnHx1Uf50, EeywK6AHQdK, jz793Wzon1W, q7NoDcfaciO, kaYz6eqxqQH"
            }
        },
        {
            "id": "total_births",
            "name": "Total Births",
            "description": null,
            "source": "dhis2",
            "enabled": true,
            "value_type": "count",
            "calculation": {
                "operation": "sum_indicators",
                "indicator_ids": [
                    "live_births",
                    "stillbirths"
                ]
            },
            "validation": {
                "status": "valid",
                "messages": []
            },
            "source_reference": {
                "workbook_row": 3,
                "original_indicator_name": "Total Births",
                "original_mapping": "Live Births + Stillbirths"
            }
        },
        {
            "id": "fresh_stillbirths",
            "name": "Fresh Stillbirths",
            "description": null,
            "source": "dhis2",
            "enabled": true,
            "value_type": "count",
            "calculation": {
                "operation": "direct",
                "operands": [
                    {
                        "type": "data_element",
                        "dx": "YLydKJIyGFF",
                        "data_element_id": "YLydKJIyGFF",
                        "category_option_combo_id": null
                    }
                ]
            },
            "validation": {
                "status": "valid",
                "messages": []
            },
            "source_reference": {
                "workbook_row": 4,
                "original_indicator_name": "Fresh Stillbirths",
                "original_mapping": "YLydKJIyGFF"
            }
        },
        {
            "id": "macerated_stillbirths",
            "name": "Macerated Stillbirths",
            "description": null,
            "source": "dhis2",
            "enabled": true,
            "value_type": "count",
            "calculation": {
                "operation": "direct",
                "operands": [
                    {
                        "type": "data_element",
                        "dx": "EJ0qYm1FrcH",
                        "data_element_id": "EJ0qYm1FrcH",
                        "category_option_combo_id": null
                    }
                ]
            },
            "validation": {
                "status": "valid",
                "messages": []
            },
            "source_reference": {
                "workbook_row": 5,
                "original_indicator_name": "Macerated Stillbirths",
                "original_mapping": "EJ0qYm1FrcH"
            }
        },
        {
            "id": "maternal_deaths",
            "name": "Maternal Deaths",
            "description": null,
            "source": "dhis2",
            "enabled": true,
            "value_type": "count",
            "calculation": {
                "operation": "direct",
                "operands": [
                    {
                        "type": "data_element",
                        "dx": "WjHvEHMCyKo",
                        "data_element_id": "WjHvEHMCyKo",
                        "category_option_combo_id": null
                    }
                ]
            },
            "validation": {
                "status": "valid",
                "messages": []
            },
            "source_reference": {
                "workbook_row": 6,
                "original_indicator_name": "Maternal Deaths",
                "original_mapping": "WjHvEHMCyKo"
            }
        },
        {
            "id": "neonatal_deaths",
            "name": "Neonatal Deaths",
            "description": null,
            "source": "dhis2",
            "enabled": true,
            "value_type": "count",
            "calculation": {
                "operation": "sum",
                "operands": [
                    {
                        "type": "data_element",
                        "dx": "jz793Wzon1W",
                        "data_element_id": "jz793Wzon1W",
                        "category_option_combo_id": null
                    },
                    {
                        "type": "data_element",
                        "dx": "bZDmsHkagGA",
                        "data_element_id": "bZDmsHkagGA",
                        "category_option_combo_id": null
                    },
                    {
                        "type": "data_element",
                        "dx": "XO2ACv2K1aW",
                        "data_element_id": "XO2ACv2K1aW",
                        "category_option_combo_id": null
                    },
                    {
                        "type": "data_element",
                        "dx": "MnmCsf59HyU",
                        "data_element_id": "MnmCsf59HyU",
                        "category_option_combo_id": null
                    }
                ]
            },
            "validation": {
                "status": "valid",
                "messages": []
            },
            "source_reference": {
                "workbook_row": 7,
                "original_indicator_name": "Neonatal Deaths",
                "original_mapping": "jz793Wzon1W, bZDmsHkagGA, XO2ACv2K1aW, MnmCsf59HyU"
            }
        },
        {
            "id": "stillbirths",
            "name": "Stillbirths",
            "description": null,
            "source": "dhis2",
            "enabled": true,
            "value_type": "count",
            "calculation": {
                "operation": "sum",
                "operands": [
                    {
                        "type": "data_element",
                        "dx": "YLydKJIyGFF",
                        "data_element_id": "YLydKJIyGFF",
                        "category_option_combo_id": null
                    },
                    {
                        "type": "data_element",
                        "dx": "EJ0qYm1FrcH",
                        "data_element_id": "EJ0qYm1FrcH",
                        "category_option_combo_id": null
                    }
                ]
            },
            "validation": {
                "status": "valid",
                "messages": []
            },
            "source_reference": {
                "workbook_row": 8,
                "original_indicator_name": "Stillbirths",
                "original_mapping": "YLydKJIyGFF, EJ0qYm1FrcH"
            }
        },
        {
            "id": "anc_visits",
            "name": "ANC Visits",
            "description": null,
            "source": "dhis2",
            "enabled": true,
            "value_type": "count",
            "calculation": {
                "operation": "sum",
                "operands": [
                    {
                        "type": "data_element",
                        "dx": "SVC5nKhvcQr",
                        "data_element_id": "SVC5nKhvcQr",
                        "category_option_combo_id": null
                    },
                    {
                        "type": "data_element",
                        "dx": "ZgDrKbIPkgE",
                        "data_element_id": "ZgDrKbIPkgE",
                        "category_option_combo_id": null
                    },
                    {
                        "type": "data_element",
                        "dx": "Jtrq0pYsqT0",
                        "data_element_id": "Jtrq0pYsqT0",
                        "category_option_combo_id": null
                    },
                    {
                        "type": "data_element",
                        "dx": "Jpkh8pokAY7",